<?xml version="1.0" encoding="UTF-8"?>
<!-- Copyright DASSAULT SYSTEMES 2013 -->
<Config xmlns="DS_DELPPWConfiguration" xmlns:xsi="http://www.w3.org/2001/XMLSchema-instance" xsi:schemaLocation="DS_DELPPWConfiguration ../xsd/GeneralPreferences.xsd" Title="General preferences" Description="Sample configuration file delivered by DS.">
  <Preferences>
    <showCollaborativeSpace type="boolean" defaultValue="true" isVisible="true"/>
    <showOrg defaultValue="false" type="boolean" isVisible="true"/>
    <showRole defaultValue="false" type="boolean" isVisible="true"/>
    <showDialog defaultValue="true" type="boolean" isVisible="true"/>
    <oneDelmiaAggregationMode defaultValue="true" type="boolean" isVisible="true"/>
    <fetchAllLevel defaultValue="false" type="boolean" isVisible="true"/>
    <loadRootOnly defaultValue="true" type="boolean" isVisible="true"/>
    <isReleaseMaturitySynced defaultValue="false" type="boolean" isVisible="true"/>
    <isChangeRequiredSynced defaultValue="false" type="boolean" isVisible="true"/>
	<timeout defaultValue="600" type="text" isVisible="true" />
    <navigateOnIndex defaultValue="Index" type="list" isVisible="true" />
    <custoParametersSet defaultValue="OOTBValue" type="string" isVisible="true"/>
    <separator defaultValue="|" type="text" isVisible="true"/>
    <csvSeparator defaultValue="Comma" type="list" isVisible="true"/>
  </Preferences>
</Config>
